{
  "$schema": "./budgets.schema.json",
  "schemaVersion": 1,
  "measurementStatus": "unmeasured",
  "performance": [
    {
      "id": "agents.loader.p95",
      "unit": "ms",
      "baseline": null,
      "threshold": null,
      "measurementArtifact": null
    },
    {
      "id": "memory.search.p95",
      "unit": "ms",
      "baseline": null,
      "threshold": null,
      "measurementArtifact": null
    },
    {
      "id": "dense-route.inp",
      "unit": "ms",
      "baseline": null,
      "threshold": null,
      "measurementArtifact": null
    },
    {
      "id": "webapp.heap.peak",
      "unit": "bytes",
      "baseline": null,
      "threshold": null,
      "measurementArtifact": null
    }
  ],
  "queries": [
    {
      "id": "agents.loader",
      "unit": "queries",
      "baseline": null,
      "threshold": null,
      "measurementArtifact": null,
      "queryCount": null,
      "fullDatasetHydration": null
    },
    {
      "id": "memory.list",
      "unit": "queries",
      "baseline": null,
      "threshold": null,
      "measurementArtifact": null,
      "queryCount": null,
      "fullDatasetHydration": null
    },
    {
      "id": "tools.matrix",
      "unit": "queries",
      "baseline": null,
      "threshold": null,
      "measurementArtifact": null,
      "queryCount": null,
      "fullDatasetHydration": null
    }
  ],
  "bundles": [
    {
      "id": "webapp.initial-js",
      "unit": "bytes",
      "baseline": null,
      "threshold": null,
      "measurementArtifact": null
    },
    {
      "id": "dense-route.lazy-js",
      "unit": "bytes",
      "baseline": null,
      "threshold": null,
      "measurementArtifact": null
    }
  ],
  "browser": {
    "viewports": ["desktop", "narrow"],
    "themes": ["light", "dark"],
    "keyboard": null,
    "overflow": null,
    "deepLinkRefresh": null,
    "failureStates": ["empty", "loading", "partial-failure", "permission", "backend-down"]
  }
}
